{
  "$schema": "./framework.schema.json",
  "id": "charter-and-course",
  "name": "Charter & Course",
  "tagline": "Define your direction, navigate your journey",
  "description": "Charter & Course is a structured approach to intentional living. Start by creating your personal 'charter' - a clear articulation of your identity, values, practices, and impact. Then use regular 'course corrections' through weekly scoreboards and quarterly reviews to stay aligned with what matters most.\n\nThis framework helps you:\n- Clarify who you are at your best\n- Define the code you live by\n- Build consistent reflection habits\n- Track progress against meaningful outcomes\n- Adjust course when life throws curveballs",
  "version": 2,
  "icon": "\ud83e\udded",
  "color": "#6366f1",
  "secondaryColor": "#818cf8",
  "isActive": true,

  "metadata": {
    "schemaVersion": "1.0.0",
    "createdAt": "2024-01-01T00:00:00Z",
    "updatedAt": "2025-01-15T00:00:00Z",
    "authors": [
      {
        "id": "lifestyle-spaces",
        "name": "Lifestyle Spaces Team"
      }
    ],
    "license": "MIT",
    "tags": ["life-planning", "identity", "values", "reflection", "accountability", "quarterly-planning"],
    "audience": "Anyone seeking intentional living, personal accountability, and structured self-improvement",
    "foundationEstimate": "60-90 minutes for Personal Charter",
    "cadenceDescription": "Weekly scoreboards (15-20 min), quarterly reviews (45-60 min), reset as needed"
  },

  "categories": [
    {
      "id": "foundation",
      "name": "Foundation",
      "description": "One-time templates to establish your personal charter",
      "order": 1,
      "icon": "\ud83c\udfdb\ufe0f",
      "color": "#6366f1"
    },
    {
      "id": "weekly",
      "name": "Weekly Practice",
      "description": "Weekly scoreboard and accountability tracking",
      "order": 2,
      "icon": "\ud83d\udcca",
      "color": "#10b981"
    },
    {
      "id": "quarterly",
      "name": "Quarterly Review",
      "description": "Quarterly deep dives, planning, and charter renewal",
      "order": 3,
      "icon": "\ud83c\udfaf",
      "color": "#ef4444"
    },
    {
      "id": "special",
      "name": "Special",
      "description": "As-needed templates for course corrections",
      "order": 4,
      "icon": "\ud83d\udd04",
      "color": "#f59e0b"
    }
  ],

  "templates": [
    {
      "id": "personal-charter",
      "name": "Personal Charter: The Architect of My Life",
      "description": "Define your core identity, code, practices, and impact. This is your foundational document for intentional living.",
      "guidance": "Take your time with this exercise. Be honest and specific. This charter becomes the standard against which you measure yourself.",
      "categoryId": "foundation",
      "lifecycle": "foundation",
      "frequency": "once",
      "order": 1,
      "icon": "\ud83d\udcdc",
      "color": "#6366f1",
      "prerequisites": [],
      "unlockedMessage": "Begin your journey by defining who you are at your best.",
      "ui": {
        "layout": "single-column",
        "showProgress": true,
        "collapsibleSections": true,
        "defaultCollapsed": false,
        "estimatedMinutes": 60,
        "introText": "Your Personal Charter is the foundation of intentional living. It defines who you are, what you stand for, how you practice, and the impact you want to have."
      },
      "content": {
        "sections": [
          {
            "id": "core-identity",
            "title": "1. Core Identity",
            "description": "Who I am at my best.",
            "icon": "\ud83d\udc8e",
            "order": 1,
            "required": true,
            "fields": ["identity-intro", "trait-dependable", "trait-forthright", "trait-generous", "trait-disciplined"]
          },
          {
            "id": "the-code",
            "title": "2. The Code: Morals & Convictions",
            "description": "The principles I live by.",
            "icon": "\u2696\ufe0f",
            "order": 2,
            "required": true,
            "fields": ["code-intro", "principle-radical-responsibility", "principle-integrity-dark", "principle-valuing-restraint", "principle-faith-alignment", "principle-service-connection"]
          },
          {
            "id": "the-practice",
            "title": "3. The Practice: Habits & Routines",
            "description": "How I build the foundation.",
            "icon": "\ud83c\udfcb\ufe0f",
            "order": 3,
            "required": true,
            "fields": ["practice-intro", "practice-physical-sovereignty", "practice-mental-clarity", "practice-sustainable-pacing"]
          },
          {
            "id": "the-impact",
            "title": "4. The Impact",
            "description": "How I show up for others.",
            "icon": "\ud83c\udf1f",
            "order": 4,
            "required": true,
            "fields": ["impact-intro", "impact-for-her", "impact-for-family", "impact-for-world"]
          },
          {
            "id": "the-vow",
            "title": "5. The Vow",
            "description": "Your commitment statement.",
            "icon": "\u2728",
            "order": 5,
            "required": true,
            "fields": ["vow-statement", "vow-signature"]
          }
        ],
        "fields": {
          "identity-intro": {
            "id": "identity-intro",
            "type": "paragraph",
            "label": "About Core Identity",
            "config": {
              "content": "These are the traits that define you when you're operating at your highest level. Be specific and honest about who you aspire to be consistently."
            }
          },
          "trait-dependable": {
            "id": "trait-dependable",
            "type": "textarea",
            "label": "Dependable",
            "helpText": "How do you show up reliably for yourself and others?",
            "placeholder": "I am the anchor. My word is iron. I do not overpromise...",
            "validation": {
              "required": true,
              "minLength": 50
            },
            "config": {
              "rows": 4,
              "defaultValue": "I am the anchor. My word is iron. I do not overpromise. If I commit, I show up: on time and fully present. I do not flake, ghost, or make promises I cannot keep."
            },
            "exportable": true,
            "outputKey": "trait-dependable"
          },
          "trait-forthright": {
            "id": "trait-forthright",
            "type": "textarea",
            "label": "Forthright",
            "helpText": "How do you speak truth with courage and care?",
            "placeholder": "I speak truth with courage and care...",
            "validation": {
              "required": true,
              "minLength": 50
            },
            "config": {
              "rows": 4,
              "defaultValue": "I speak truth with courage and care. I do not avoid difficult conversations or hide behind insight. I own my feelings, mistakes, and desires without excuses or performance."
            },
            "exportable": true,
            "outputKey": "trait-forthright"
          },
          "trait-generous": {
            "id": "trait-generous",
            "type": "textarea",
            "label": "Generous",
            "helpText": "How do you serve those you love?",
            "placeholder": "I serve those I love not to earn affection...",
            "validation": {
              "required": true,
              "minLength": 50
            },
            "config": {
              "rows": 4,
              "defaultValue": "I serve those I love not to earn affection, but because service is my language. I seek unseen needs and meet them quietly, without keeping score."
            },
            "exportable": true,
            "outputKey": "trait-generous"
          },
          "trait-disciplined": {
            "id": "trait-disciplined",
            "type": "textarea",
            "label": "Disciplined",
            "helpText": "How do you lead yourself?",
            "placeholder": "I lead myself. I do not bargain with impulses...",
            "validation": {
              "required": true,
              "minLength": 50
            },
            "config": {
              "rows": 4,
              "defaultValue": "I lead myself. I do not bargain with impulses; I train them. I choose what is right over what is easy, especially when no one is watching."
            },
            "exportable": true,
            "outputKey": "trait-disciplined"
          },
          "code-intro": {
            "id": "code-intro",
            "type": "paragraph",
            "label": "About The Code",
            "config": {
              "content": "These are the non-negotiable principles that guide your decisions and actions. They form the moral foundation of your life."
            }
          },
          "principle-radical-responsibility": {
            "id": "principle-radical-responsibility",
            "type": "textarea",
            "label": "Radical Responsibility",
            "helpText": "How do you own your emotional state and choices?",
            "placeholder": "I own my emotional state...",
            "validation": {
              "required": true,
              "minLength": 50
            },
            "config": {
              "rows": 4,
              "defaultValue": "I own my emotional state. I do not make others responsible for my happiness, pain, or choices. I choose my path with eyes open and accept the cost without complaint or victimhood."
            },
            "exportable": true,
            "outputKey": "principle-radical-responsibility"
          },
          "principle-integrity-dark": {
            "id": "principle-integrity-dark",
            "type": "textarea",
            "label": "Integrity in the Dark",
            "helpText": "How is your character defined in private?",